{
  "name": "Gambler",
  "skill_points": "EDU * 2 + APP * 2 or DEX * 2",
  "credit_rating_range": { "min": 8, "max": 50 },
  "skills": [
    "Accounting",
    "Art/Craft (Acting)",
    { "choice": ["Charm", "Fast Talk", "Intimidate", "Persuade"], "label": "interpersonal" },
    { "choice": ["Charm", "Fast Talk", "Intimidate", "Persuade"], "label": "interpersonal" },
    "Listen",
    "Psychology",
    "Sleight of Hand",
    "Spot Hidden",
    "Credit Rating"
  ]
}
