{
  "name": "Criminal",
  "skill_points": "EDU * 2 + DEX * 2 or STR * 2",
  "credit_rating_range": { "min": 5, "max": 65 },
  "characteristic_ranges": {
    "DEX": { "min": 40 }
  },
  "skills": [
    { "choice": ["Charm", "Fast Talk", "Intimidate", "Persuade"], "label": "interpersonal" },
    "Psychology",
    "Spot Hidden",
    "Stealth",
    { "choice": ["Appraise", "Disguise", "Fighting (any)", "Firearms (any)", "Locksmith", "Mechanical Repair", "Sleight of Hand"], "label": "specialism" },
    { "choice": ["Appraise", "Disguise", "Fighting (any)", "Firearms (any)", "Locksmith", "Mechanical Repair", "Sleight of Hand"], "label": "specialism" },
    { "choice": ["Appraise", "Disguise", "Fighting (any)", "Firearms (any)", "Locksmith", "Mechanical Repair", "Sleight of Hand"], "label": "specialism" },
    { "choice": ["Appraise", "Disguise", "Fighting (any)", "Firearms (any)", "Locksmith", "Mechanical Repair", "Sleight of Hand"], "label": "specialism" },
    "Credit Rating"
  ]
}
