{
  "name": "Laborer",
  "skill_points": "EDU * 2 + DEX * 2 or STR * 2",
  "credit_rating_range": { "min": 9, "max": 30 },
  "skills": [
    "Drive Auto",
    "Electrical Repair",
    "Fighting (any)",
    "First Aid",
    "Mechanical Repair",
    "Operate Heavy Machinery",
    "Throw",
    { "choice": "any" },
    "Credit Rating"
  ]
}
