{
  "name": "Sailor, Naval",
  "skill_points": "EDU * 2 + DEX * 2 or STR * 2",
  "credit_rating_range": {
    "min": 9,
    "max": 30
  },
  "skills": [
    {
      "choice": [
        "Electrical Repair",
        "Mechanical Repair"
      ],
      "label": "technical"
    },
    "Fighting (any)",
    "Firearms (any)",
    "First Aid",
    "Navigate",
    "Pilot (Boat)",
    "Survival (Sea)",
    "Swim",
    "Credit Rating"
  ]
}
