{
  "name": "Waitress/Waiter",
  "skill_points": "EDU * 2 + APP * 2 or DEX * 2",
  "credit_rating_range": { "min": 9, "max": 20 },
  "skills": [
    "Accounting",
    "Art/Craft (any)",
    "Dodge",
    "Listen",
    { "choice": ["Charm", "Fast Talk", "Intimidate", "Persuade"], "label": "interpersonal" },
    { "choice": ["Charm", "Fast Talk", "Intimidate", "Persuade"], "label": "interpersonal" },
    "Psychology",
    { "choice": "any" },
    "Credit Rating"
  ]
}
