{
  "name": "Acrobat",
  "skill_points": "EDU * 2 + DEX * 2",
  "credit_rating_range": {
    "min": 9,
    "max": 20
  },
  "characteristic_ranges": {
    "DEX": {
      "min": 50
    }
  },
  "skills": [
    "Climb",
    "Dodge",
    "Jump",
    "Throw",
    "Spot Hidden",
    "Swim",
    {
      "choice": "any"
    },
    {
      "choice": "any"
    },
    "Credit Rating"
  ]
}
