{
  "name": "Hacker",
  "skill_points": "EDU * 4",
  "credit_rating_range": { "min": 10, "max": 70 },
  "characteristic_ranges": {
    "INT": { "min": 60 }
  },
  "skills": [
    "Computer Use",
    "Electrical Repair",
    "Electronics",
    "Library Use",
    "Spot Hidden",
    { "choice": ["Charm", "Fast Talk", "Intimidate", "Persuade"], "label": "interpersonal" },
    { "choice": "any" },
    { "choice": "any" },
    "Credit Rating"
  ]
}
