{
  "name": "Museum Curator",
  "skill_points": "EDU * 4",
  "credit_rating_range": {
    "min": 10,
    "max": 30
  },
  "personal_interest_weights": {
    "Other Language": 3,
    "Fighting": 0.2,
    "Firearms": 0.2,
    "Survival": 0.3,
    "Navigate": 0.3
  },
  "skills": [
    "Accounting",
    "Appraise",
    "Archaeology",
    "History",
    "Library Use",
    "Occult",
    "Other Language (any)",
    "Spot Hidden",
    "Credit Rating"
  ]
}
